202,PUSAT PAKAR UKM,"TINGKAT 1, 2 DAN 7, BLOK KLINIKAL & TINGKAT BAWAH DAN TINGKAT 1 BLOK GAMMA KNIFE, PUSAT PERUBATAN UKM, JALAN YAACOB LATIF, BANDAR TUN RAZAK",56000,KUALA LUMPUR,WP KUALA LUMPUR,62,6,5,,,,,,,,,
203,PRINCE COURT MEDICAL CENTRE ,"39, JALAN KIA PENG",50450,KUALA LUMPUR,WP KUALA LUMPUR,288,5,17,8,,,,21,5,4,,
204,PUSAT PERUBATAN ROOPI MEDICAL CENTRE SDN BHD,"86, JALAN DATO HAJI EUSOFF, DAMAI COMPLEX",50400,KUALA LUMPUR,WP KUALA LUMPUR,4,,4,,,,,,,,,
205,SUNWAY MEDICAL CENTRE VELOCITY,"PUSAT PERUBATAN SUNWAY VELOCITY, LINGKARAN SV, SUNWAY VELOCITY",55100,KUALA LUMPUR,WP KUALA LUMPUR,229,16,23,6,,3,18,2,2,,,
206,TUNG SHIN HOSPITAL,UKM SPECIALIST CENTRE SDN. BHD.,55100,KUALA LUMPUR,WP KUALA LUMPUR,157,2,17,8,,,17,,,1,,
207,HOSPITAL COLUMBIA ASIA,"NO. 9, JALAN JALIL PERKASA 7, BUKIT JALIL",57000,KUALA LUMPUR,WP KUALA LUMPUR,34,,4,,4,,,,,,,
208,HOSPITAL AZALEA PUTRAJAYA,"B1-LG-2, B1-LG-3, B1-G-2, B-1-G-3, B1-1-2 & B1-1-3, AYER@8, JALAN P8G, PRESINT 8",62250,PUTRAJAYA,WP PUTRAJAYA,4,,5,,,,,,,,,
209,SUNWAY MEDICAL CENTRE DAMANSARA (PUSAT PERUBATAN SUNWAY MEDICAL),"NO 2 JALAN PJU 5/1A, KOTA DAMANSARA, PJU 5 ",47810,PETALING JAYA,SELANGOR,156,6,10,3,,2,10,7,,,,
210,STELLA KASIH MEDICAL CENTRE,"LOT 192, BLOK B, JALAN P8C/1, PUSAT PERNIAGAAN PRESINT 8",62250,PUTRAJAYA,WP PUTRAJAYA,20,,,,,1,,,,,,
211,MAHSA SPECIALIST HOSPITAL (HOSPITAL PAKAR MAHSA),"JALAN SP 1/3, BANDAR SAUJANA PUTRA, JENJAROM",42610,SELANGOR,SELANGOR,37,,4,2,,,6,,,,,
212,SUNWAY MEDICAL CENTRE IPOH,"2, PERSIARAN SUNWAY, SUNWAY CITY IPOH",31150,IPOH,PERAK,165,,10,4,,3,11,6,,,,
213,KPJ KUALA SELANGOR SPECIALIST HOSPITAL,"NO.1 JALAN PENINSULA TANJUNG, PENINSULA UTAMA",45000,SELANGOR,SELANGOR,65,,3,2,,,,,,,,