TARIKH KEMASKINI :,,04/06/2025,,,,,,,,,,,,,,,
BIL,NAMA_PENUH_FASILITI,ALAMAT,POSKOD,BANDAR,NEGERI,JUMLAH_KATIL,KERUSI_SANDAR,BASINET,KOT,KATIL_KOT,KOT_FOTOTERAPI,KERUSI_DIALISIS,KATIL_DIALISIS,MOBILE_MESIN_DIALISIS,KERUSI_PERGIGIAN,MH_CHAMBER,KATIL_BLOOD_DONOR
1,COLUMBIA ASIA HOSPITAL,"PERSIARAN SOUTHKEY 5, KOTA SOUTHKEY",80150,JOHOR BAHRU,JOHOR,151,5,10,4,,,9,2,,,,
2,COLUMBIA ASIA HOSPITAL  -  ISKANDAR PUTERI,"PERSIARAN AFIAT, TAMAN KESIHATAN AFIAT",79250,ISKANDAR PUTERI,JOHOR,164,8,8,4,,2,,,,,,
3,GLENEAGLES HOSPITAL JOHOR,"NO. 2, JALAN MEDINI UTARA 4, MEDINI ISKANDAR",79250,ISKANDAR PUTERI,JOHOR,208,24,9,4,,,10,,,3,,
4,JOHOR SPECIALIST HOSPITAL,"39-B, JALAN ABDUL SAMAD",80100,JOHOR BAHRU,JOHOR,282,12,4,3,,,36,,2,,,
5,HOSPITAL PAKAR SKUDAI (SKUDAI SURGICAL CENTRE (M) SDN. BHD.),"TINGKAT BAWAH, NO. 5 & 7, JALAN RONGGENG 2, TAMAN SKUDAI BARU",81300,JOHOR BAHRU,JOHOR,6,,,,,,,,,,,
6,HOSPITAL PENAWAR,"NO. 17 & 18 (A-D), PUSAT PERNIAGAAN PASIR GUDANG",81700,PASIR GUDANG,JOHOR,40,,10,,,,,,,,,
7,KEMPAS MEDICAL CENTRE,"LOT PTD 7522, JALAN KEMPAS BARU",81200,JOHOR BAHRU,JOHOR,47,,8,,,,6,,,,,
8,KENSINGTON GREEN SPECIALIST CENTRE SDN. BHD.,"NO. 2, JALAN CERIA 20, TAMAN NUSA INDAH, ISKANDAR PUTERI",79100,JOHOR BAHRU,JOHOR,22,,8,1,,1,,,,,,
9,KLUANG SPECIALIST MATERNITY CENTRE,"NO. 2, 3, 4, JALAN HAJI MANAP NORDIN, KLUANG BARU",86000,KLUANG,JOHOR,2,,2,,,,,,,,,
10,KPJ BANDAR DATO’ ONN SPECIALIST HOSPITAL,"NO 2, JALAN BUKIT MUTIARA, TAMAN BUKIT MUTIARA",81100,JOHOR BAHRU,JOHOR,130,6,7,3,,2,14,,2,,,
11,KPJ BANDAR MAHARANI SPECIALIST HOSPITAL,"NO. 73-1, JALAN STADIUM",84000,MUAR,JOHOR,91,,5,1,,1,9,,,,,
12,KPJ BATU PAHAT SPECIALIST HOSPITAL,"NO. 1, JALAN MUTIARA GADING UTAMA 1, TAMAN MUTIARA GADING",83000,BATU PAHAT,JOHOR,61,,2,,,2,6,,,,,
13,KPJ KLUANG SPECIALIST HOSPITAL,"PTD 91374, JALAN SAUJANA UTAMA, TAMAN SAUJANA KLUANG, MUKIM KLUANG",86000,KLUANG,JOHOR,81,,4,4,,,13,,,,,
14,PUTERI SPECIALIST HOSPITAL,"NO. 33, JALAN TUN ABDUL RAZAK, (SUSUR 5)",80000,JOHOR BAHRU,JOHOR,192,,8,7,34,3,20,,,,,
15,LANDMARK MEDICAL CENTRE,"UNIT 33B, LEVEL 33B, MENARA LANDMARK, JALAN NGEE HENG",80000,JOHOR BAHRU,JOHOR,8,,4,,,,,,,,,
16,MARIA HOSPITAL,"BLOK A, WISMA MARIA, JALAN NGEE HENG",80100,JOHOR BAHRU,JOHOR,14,,,,,,,,,,,
17,PANTAI HOSPITAL BATU PAHAT,"NO. 9S, JALAN BINTANG SATU, TAMAN KOPERASI BAHAGIA",83000,BATU PAHAT,JOHOR,116,,8,4,,,6,,,,,
18,PASIR GUDANG SPECIALIST HOSPITAL,"LOT PTD 204781, JALAN PERSIARAN DAHLIA 2, TAMAN BUKIT DAHLIA",81700,PASIR GUDANG,JOHOR,148,,3,1,,1,11,,,,,
19,PUSAT PAKAR BERSALIN TEBRAU,"NO. 2, PUSAT PAKAR BERSALIN TEBRAU, JALAN KENCANA EMAS 1/7, KAWASAN PERINDUSTRIAN TEBRAU III",81100,JOHOR BAHRU,JOHOR,10,,8,,,,,,,,,
20,PUSAT PAKAR PERBIDANAN DAN WANITA PERDANA,"NO. 51 & 52, JALAN PENDIDIKAN 3, TAMAN UNIVERSITI",81300,SKUDAI,JOHOR,2,,2,,,,,,,,,
21,"PUSAT PAKAR PERBIDANAN, SAKIT PUAN DAN KANAK- KANAK","NO. 21, JALAN SULAIMAN",84000,MUAR,JOHOR,13,,8,,,,,,,,,
22,PUSAT PAKAR SAKIT PUAN DAN PERBIDANAN KHOR & LOH SDN. BHD,"NO 145, 147 & 149-02, JALAN BESTARI 1/5, TAMAN NUSA BESTARI",81300,SKUDAI,JOHOR,13,,6,,,,,,,,,
23,PUTRA SPECIALIST HOSPITAL (BATU PAHAT) SDN. BHD.,"NO. 1, JALAN PESERAI",83000,BATU PAHAT,JOHOR,82,,8,,,,,,,,,
24,REGENCY SPECIALIST HOSPITAL,"NO. 1, JALAN SURIA, BANDAR SERI ALAM",81750,MASAI,JOHOR,190,7,20,2,,,12,,,,,
25,JB SPECIALIST HOSPITAL,"38, 38-1 & 40, 40-1 JALAN ROS MERAH 3/2, TAMAN JOHOR JAYA",81100,JOHOR BAHRU,JOHOR,4,,,,,,,,,,,
26,PUSAT PAKAR WANITA DAN PERBIDANAN JOHOR,"NO 38-42, JALAN CANTIK",86000,KLUANG,JOHOR,3,,4,,,,,,,,,
27,INS SPECIALIST CENTRE SDN. BHD.,"640-641, JALAN PINTU SEPULUH",05100,ALOR SETAR,KEDAH,20,,12,,,,,,,,,
28,KEDAH MEDICAL CENTRE,PUMPONG,05250,ALOR SETAR,KEDAH,159,,8,,,,18,,,,,
29,MAHSURI MEDICAL CENTRE (MMC),"NO. 1, 2 & 3, JALAN MAHSURI, 1C, BANDAR BARU DARULAMAN",06000,JITRA,KEDAH,6,,4,4,,,,,,,,
30,METRO SPECIALIST HOSPITAL,"NO 1, LORONG METRO",08000,SUNGAI PETANI,KEDAH,102,,8,,,,15,,1,1,,
31,PANTAI HOSPITAL LAGUNA MERBOK,"1, LORONG BLM 1/10, BANDAR LAGUNA MERBOK",08000,SUNGAI PETANI,KEDAH,95,,5,,,,12,1,,,,
32,PANTAI HOSPITAL SUNGAI PETANI,"NO. 1, PERSIARAN CEMPAKA, BANDAR AMANJAYA",08000,SUNGAI PETANI,KEDAH,119,6,10,,10,,18,,1,,,
33,PUTRA MEDICAL CENTRE,"888, JALAN SEKERAT, OFF JALAN PUTRA",05100,ALOR SETAR,KEDAH,121,,5,,,3,9,,,3,,
34,PUTERI AYU MATERNITY CENTRE,"10, LORONG 17, TAMAN PETANI JAYA",08000,SUNGAI PETANI,KEDAH,4,,4,,,,,,,,,
35,AURELIUS HOSPITAL ALOR SETAR,"NO. B-5, PERSIARAN BANDAR BARU MERGONG, JALAN PERUSAHAAN 1, BANDAR BARU MERGONG",05150,ALOR SETAR,KEDAH,182,,20,4,,,"12
18",,,,,
36,KPJ PERDANA SPECIALIST HOSPITAL,"LOT PT 37 & 600, DAN LOT 684 (LEVEL 1, 2 & 3) SEKSYEN14, JALAN BAYAM",15200,KOTA BHARU,KELANTAN,169,,6,,,,10,,,,,
37,PUSAT PERUBATAN AN-NISA’,"GROUND FLOOR, JKR 284, JALAN SULTAN IBRAHIM",15050,KOTA BHARU,KELANTAN,6,,4,,,,,,,,,
38,KOTA BHARU MEDICAL CENTRE,"PT 179 - 184, JALAN SULTAN YAHYA PETRA, LUNDANG",15150,KOTA BHARU,KELANTAN,49,,10,,,,,,,,,
39,MAHKOTA MEDICAL CENTRE ,"3, MAHKOTA MELAKA, JALAN MELAKA",75000,MELAKA,MELAKA,274,22,11,2,,,10,20,2,6,,
40,ORIENTAL MELAKA STRAITS MEDICAL CENTRE,PUSAT PERUBATAN KLEBANG,75200,MELAKA,MELAKA,211,,6,2,,2,12,,2,2,,
41,PANTAI HOSPITAL AYER KEROH,"NO. 2418-1, KM 8 LEBUH AYER KEROH",75450,MELAKA,MELAKA,239,9,20,3,2,,14,,3,2,,
42,PUTRA SPECIALIST HOSPITAL (MELAKA) SDN. BHD.,"169, JALAN BENDAHARA",75100,MELAKA,MELAKA,220,,6,,9,6,19,,2,,,
43,AURELIUS HOSPITAL NEGERI SEMBILAN,"PT 13717, JALAN BBN 2/1",71800,NILAI ,NEGERI SEMBILAN,97,4,4,,,,,,,,,
44,CMH SPECIALIST HOSPITAL,"BLOCK A (GROUND FLOOR) & BLOCK B , LOT 3900, JALAN TUN DR. ISMAIL",70200,SEREMBAN,NEGERI SEMBILAN,66,,5,,,,,,1,,,
45,COLUMBIA ASIA HOSPITAL – SEREMBAN,"292 & LOT PT 1904, JALAN HARUAN 2, OAKLAND COMMERCIAL CENTRE",70300,SEREMBAN,NEGERI SEMBILAN,114,2,9,3,,2,,,,,,
46,KPJ SEREMBAN SPECIALIST HOSPITAL,"LOT 6219 & 6220, JALAN TOMAN 1, KEMAYAN SQUARE",70200,SEREMBAN,NEGERI SEMBILAN,217,,9,1,,,34,,,,,
47,MAWAR MEDICAL CENTRE,"NO. 71, JALAN RASAH",70300,SEREMBAN,NEGERI SEMBILAN,88,,,,,,44,,,,,
48,SALAM SENAWANG SPECIALIST HOSPITAL,"NO. 234-243, JALAN LAVENDER HEIGHTS 2, LAVENDER BUSINESS SQUARE",70450,SENAWANG,NEGERI SEMBILAN,95,,6,,,,,,,,,
49,UCSI HOSPITAL,"NO 2, AVENUE 3, PERSIARAN SPRINGHILL",71010,PORT DICKSON,NEGERI SEMBILAN,68,,4,,,1,6,,,,,
50,DARUL MAKMUR MEDICAL CENTRE SDN. BHD.,"B2-B60, JALAN PINGGIRAN PUTRA 4/3, PINGGIRAN PUTRA 4",26060,KUANTAN,PAHANG,42,,,,,,,,,,,
51,KMI KUANTAN MEDICAL CENTRE,"JALAN TUN RAZAK, BANDAR INDERA MAHKOTA",25200,KUANTAN,PAHANG,176,,6,,,2,5,,,,,
52,KPJ PAHANG SPECIALIST HOSPITAL,"LOT 105703 (PT 83065), TANJUNG LUMPUR",26060,KUANTAN,PAHANG,136,,8,2,,,,,,,,
53,AURELIUS HOSPITAL PAHANG,"LOT 1, 3, 5 & 7 WISMA MUIP, JALAN GAMBUT",25000,KUANTAN,PAHANG,58,6,5,2,,,,,,,,
54,IIUM MEDICAL SPECIALIST CENTRE (IMSC),"KULLIYYAH OF MEDICINE, INTERNATIONAL ISLAMIC UNIVERSITY MALAYSIA, INDERA MAHKOTA",25200,KUANTAN,PAHANG,353,7,6,6,,,4,,,,,
55,BAGAN SPECIALIST CENTRE,JALAN BAGAN SATU,13400,BUTTERWORTH,PULAU PINANG,182,3,15,3,,4,,,,,,
56,GEORGETOWN SPECIALIST HOSPITAL,"NO. 12-A, JALAN MASJID NEGERI",11600,GEORGETOWN,PULAU PINANG,20,,,,,,8,,,,,
57,GLENEAGLES HOSPITAL PENANG,"NO. 1, JALAN PANGKOR",10050,GEORGETOWN,PULAU PINANG,327,27,3,,,3,24,,3,,,
58,HOPE CHILDREN HOSPITAL – GOTTLIEB,"25B, C & D, JALAN GOTTLIEB",10350,GEORGETOWN,PULAU PINANG,10,,,,,,,,,,,
59,"HOSPITAL KEBAJIKAN KEK LOK SI 
KEK LOK SI CHARITABLE HOSPITAL","NO. 623, JALAN BALIK PULAU, AYER ITAM",11500,PULAU PINANG,PULAU PINANG,46,,,,,,6,,,,,
60,ISLAND HOSPITAL,"NO. 308, JALAN MACALISTER",10450,GEORGETOWN,PULAU PINANG,491,19,4,4,,,16,2,3,1,,
61,KPJ PENANG SPECIALIST HOSPITAL,"570, JALAN PERDA UTAMA, BANDAR PERDA",14000,BUKIT MERTAJAM,PULAU PINANG,319,,6,2,,1,20,,,1,,
62,KS WAN & LIOW SPECIALIST MATERNITY CENTRE SDN BHD,"NO. 17 & 19, LORONG TEMBIKAI 6, PUSAT KOMERSIAL SRI RAMBAI",14000,BUKIT MERTAJAM,PULAU PINANG,4,,4,,,,,,,,,
63,LOH GUAN LYE SPECIALISTS CENTRE,"238, MACALISTER DAN 19 & 21, JALAN LOGAN ",10400,GEORGETOWN ,PULAU PINANG,205,17,7,3,28,,13,,,3,,
64,MOUNT MIRIAM CANCER HOSPITAL,"23, JALAN BULAN, FETTES PARK",11200,TANJUNG BUNGAH,PULAU PINANG,30,,,,,,,,,,,
65,OPTIMAX EYE SPECIALIST HOSPITAL (PENANG),"TINGKAT BAWAH, NO. 223, JALAN MASJID NEGERI",11600,GEORGETOWN,PULAU PINANG,4,,,,,,,,,,,
66,PANTAI HOSPITAL PENANG,"82, JALAN TENGAH, BAYAN BARU",11900,BAYAN LEPAS,PULAU PINANG,204,8,4,5,,,22,,,3,,
67,PEACE MEDICAL CENTRE,"81, LORONG SELAMAT",10400,GEORGETOWN,PULAU PINANG,4,,4,,,,,,,,,
68,PENANG ADVENTIST HOSPITAL,"465, JALAN BURMA",10350,PULAU PINANG,PULAU PINANG,261,19,16,10,,,27,,,16,,11
69,QUESTRA BIO - CLINICAL RESEARCH CENTRE,"ARAS BAWAH (NO.6) DAN ARAS 1&2 ( NO.2A,NO.6 DAN NO.8) JALAN DESA PAUH",13700,PERMATANG PAUH,PULAU PINANG,57,,,,,,,,,,,
70,SUNWAY MEDICAL CENTRE PENANG,"3106, LEBUH TENGGIRI 2, PUSAT BANDAR SEBERANG JAYA",13700,PERAI,PULAU PINANG,287,16,19,5,,3,19,2,1,,,
71,DBM HOSPITAL,"NO 18 & 20, JALAN CERMAI 1, TAMAN CERMAI, JALAN SAMA GAGAH, PERMATANG PAUH",13500,SEBERANG PERAI,PULAU PINANG,4,,4,,,,,,,,,
72,HOSPITAL LAM WAH EE,"141, JALAN TAN SRI THE EWE LIM",11600,GEORGETOWN,PULAU PINANG,416,,20,5,,5,25,,2,5,,
73,NORTHERN HEART HOSPITAL PENANG ,"NO 2 LEBUHRAYA PEEL, SEKSYEN 4",10350,GEORGETOWN,PULAU PINANG,31,,,,,,,,,,,
74,ANSON BAY MEDICAL CENTRE,"LOT 992, BATU 3,1/2, JALAN MAHARAJALELA",36000,TELUK INTAN,PERAK,65,,5,4,,,10,,,,,
75,APOLLO MEDICAL CENTRE,"NO. 271, JALAN TAMING SARI",34000,TAIPING,PERAK,12,,,,,,,,,,,
76,BERNAM RIVER ULU GROUP HOSPITAL,ULU BERNAM ESTATE,36500,ULU BERNAM,PERAK,20,,,,,,,,,,,
77,COLUMBIA ASIA HOSPITAL – TAIPING,"NO. 5, JALAN PERWIRA",34000,TAIPING,PERAK,62,1,8,2,,,,,,,,
78,HOSPITAL AR- RIDZUAN,"A-1, B-G-3 & B-G-5, B-1-1 &B-1-3, GREENTOWN SURIA, JALAN DATO’ SERI AHMAD SAID",30450,IPOH,PERAK,6,,5,,,,20,,,,,
79,HOSPITAL FATIMAH,"1, LEBOH CHEW PENG LOON, OFF JALAN DATO' LAU PAK KHUAN, IPOH GARDEN",31400,IPOH,PERAK,254,8,6,2,,2,23,,,,,
80,HOSPITAL SERI BOTANI,"NO. 3, DATARAN BOTANI 2, BANDAR SERI BOTANI",31350,IPOH,PERAK,48,,2,,2,2,8,,,,,
81,HOSPITAL UNIVERSITI TUNKU ABDUL RAHMAN,JALAN HOSPITAL UTAR,31900,KAMPAR,PERAK,32,,4,,6,,,,,,,
82,JENDARATA GROUP HOSPITAL,JENDARATA ESTATE,36009,TELUK INTAN,PERAK,18,,,,,,,,,,,
83,KLINIK BERSALIN YASMIN,"NO. 27 - 28, PERSIARAN VENICE SUTERA 1, DESA MANJUNG RAYA",32200,LUMUT,PERAK,2,,2,,,,,,,,,
84,KMC MEDICAL CENTRE,"20A, JALAN CHUNG THYE PHIN",30250,IPOH,PERAK,32,,10,,,,,,,,,
85,IPOH SPECIALIST HOSPITAL,"26, JALAN RAJA DIHILIR",30350,IPOH,PERAK,241,,37,2,24,,41,,,,,
86,KPJ SRI MANJUNG SPECIALIST HOSPITAL,"LOT 14777, JALAN LUMUT",32000,SITIAWAN,PERAK,47,,4,,,,,,,,,
87,PANTAI HOSPITAL IPOH,"126, JALAN TAMBUN",31400,IPOH,PERAK,225,8,4,1,,,29,,,1,,
88,PANTAI HOSPITAL MANJUNG,"JALAN PPMP 1, PUSAT PERNIAGAAN MANJUNG POINT",32040,SERI MANJUNG,PERAK,59,,12,2,,,,,,,,
89,PERAK COMMUNITY SPECIALIST HOSPITAL,"NO. 277, JALAN RAJA PERMAISURI BAINUN",30250,IPOH,PERAK,114,,8,,5,,18,,,,,
90,PUSAT PAKAR PERMATA RAOOFAH,"NO. 37, 39 & 41, LENGKUK KLEDANG RAYA, TAMAN KLEDANG JAYA, JALAN JELAPANG",30100,IPOH,PERAK,8,,8,1,,,,,,,,
91,SEJATI MATERNITY & SPECIALIST CENTRE,"NO. 20, TAMAN SEJATI 1",32000,SETIAWAN,PERAK,2,,2,,,,,,,,,
92,TAIPING MEDICAL CENTRE,"45-49, JALAN MEDAN TAIPING 2",34000,TAIPING,PERAK,48,,10,,,,11,,,,,
93,KPJ PERLIS SPECIALIST HOSPITAL (HOSPITAL PAKAR KPJ PERLIS),"LOT 2550 & 2575, PENGKALAN ASAM, MUKIM SERIAB",01000,KANGAR,PERLIS,61,,4,,,,,,,,,
94,ARA DAMANSARA MEDICAL CENTRE,"2, JALAN LAPANGAN TERBANG, SEKSYEN U2",40150,SHAH ALAM,SELANGOR,117,,,,,,6,,,,,
95,ASSUNTA HOSPITAL,JALAN TEMPLER,46990,PETALING JAYA,SELANGOR,271,4,8,5,,,18,,,,,
96,AVISENA SPECIALIST HOSPITAL,"NO. 4, JALAN IKHTISAS, SEKSYEN 14",40000,SHAH ALAM,SELANGOR,120,,,,,,,,,,,
97,AVISENA WOMEN’S & CHILDREN’S SPECIALIST HOSPITAL,"No. 3, Jalan Perdagangan 14/4, Seksyen 14",40000,SHAH ALAM,SELANGOR,130,,15,7,,,,,,2,,
98,BEACON HOSPITAL,"1, JALAN 215, SEKSYEN 51, OFF JALAN TEMPLER",46050,PETALING JAYA,SELANGOR,108,7,,,,,,,,,,
99,BRITANNIA WOMEN SPECIALIST CENTRE,"NO. 65-67, ARAS BAWAH, ARAS 1 DAN ARAS 2, JALAN TKS 1, TAMAN KAJANG SENTRAL",43000,KAJANG,SELANGOR,12,,8,,,,,,,,,
100,BUKIT TINGGI MEDICAL CENTRE,"LOT 83211, PERSIARAN BATU NILAM 9/KS6, BANDAR BUKIT TINGGI",41200,KLANG,SELANGOR,159,,18,,12,1,10,,,2,,
101,COLUMBIA ASIA HOSPITAL,"LOT 69, JALAN 13/6, SEKSYEN 13",46200,PETALING JAYA,SELANGOR,67,1,10,,,,,,,,,
102,COLUMBIA ASIA HOSPITAL,"PT 71153, JALAN MAHKOTA 1/KU2, MUTIARA BUKIT RAJA 2, KM 2, OFF JALAN MERU",41050,KLANG,SELANGOR,84,,8,2,,2,10,,,,,
103,COLUMBIA ASIA HOSPITAL,"LOT 33107, JALAN SUAKASIH",43200,CHERAS,SELANGOR,79,4,6,,,2,,,,,,
104,COLUMBIA ASIA HOSPITAL,"NO. 3, PERSIARAN ANGGERIK ERIA, BUKIT RIMAU, SEKSYEN 32",40460,SHAH ALAM,SELANGOR,98,8,7,,4,3,,,,,,
105,COLOMBIA HOSPITAL,"NO. 1, LEBUH PUTERI, BANDAR PUTERI PUCHONG",47100,PUCHONG,SELANGOR,83,4,10,,,2,,,,,,
106,HOSPITAL BERSALIN & POLIKLINIK PUSRAWI PUSRAWI CORPORATION SDN. BHD. KOTA DAMANSARA,"NO. 22, TINGKAT BAWAH & TINGKAT 1, JALAN PEKAKA 8/3, SEKSYEN 8",47810,PETALING JAYA,SELANGOR,8,,5,,,,,,,,,
107,HOSPITAL BERSALIN RAZIF,"NO. 33, 35, 37 & 39, JALAN SRI SARAWAK, 20A/KS2, TAMAN SRI ANDALAS",41200,KLANG,SELANGOR,13,,10,,,,,,,,,
108,HOSPITAL ISLAM AZ-ZAHRAH,"NO. 24, 26, 28, 30, 32 & 34, MEDAN PUSAT BANDAR 1, SEKSYEN 9",43650,BANDAR BARU BANGI,SELANGOR,42,,6,,,,,,,,,
109,HOSPITAL MATA NASIONAL TUN HUSSEIN ONN (THE TUN HUSSEIN ONN NATIONAL EYE HOSPITAL),"LOT 2, LORONG UTARA B",46200,PETALING JAYA,SELANGOR,30,8,,,,,,,,,,
110,HOSPITAL PAKAR AN-NUR SPECIALIST HOSPITAL,"JALAN GERBANG WAWASAN 1, SEKSYEN 15",43650,BANDAR BARU BANGI,SELANGOR,102,,22,,,1,8,,,,,
111,HOSPITAL RAWATAN LANJUTAN COLUMBIA ASIA (COLUMBIA ASIA EXTENDED CARE HOSPITAL),"LOT NO. 2, JALAN BAUNG 17/22, SEKSYEN 17",40200,SHAH ALAM,SELANGOR,60,,,,,,,,,,,
112,HOSPITAL UMRA,"TINGKAT 1 & 2, NO. 14, 16, & 18, JALAN BOLA TAMPAR 13/14, SEKSYEN 13",40100,SHAH ALAM,SELANGOR,35,,8,,2,4,,,,,,
113,HOSPITAL WANITA DAN KANAK-KANAK ANDORRA WOMEN & CHILDREN HOSPITAL,"NO 19, JALAN UTAMA SURIA TROPIKA 1, TAMAN SURIA TROPIKA",43300,SERI KEMBANGAN,SELANGOR,34,,18,,,2,,,,,,
114,HOSPITAL WANITA METRO,"NO. 22-26, JALAN EMAS 1, BANDAR SUNGAI EMAS, SUNGAI MANGGIS",42700,BANTING,SELANGOR,4,,4,,,,,,,,,
115,HOSPITAL WANITA METRO,"NO. 32-38, JALAN PASAR",41400,KLANG,SELANGOR,17,,4,,,,,,,,,
116,JMC SPECIALIST MEDICAL CENTRE,"NO. 80, JALAN TELOK GADONG, DI PERSIARAN RAJA MUDA MUSA",41100,KLANG,SELANGOR,22,,8,,,,,,,,,
117,KAJANG PLAZA MEDICAL CENTRE,"NO. 35, 36, 33B, 34B, 35B, 36B DAN 36C, JALAN DATO' SERI ALAGENDRA 2, KAJANG PLAZA",43000,KAJANG,SELANGOR,30,,10,,,,,,,,,
118,KLINIK PAKAR WANITA DAN BERSALIN SUBANG PERMAI,"NO 19, JALAN ALFA FU 6/F, PUSAT PERDAGANGAN SUBANG PERMAI, SEKSYEN U6",40150,SHAH ALAM,SELANGOR,6,,3,,,,,,,,,
119,KLINIK PAKAR WANITA DAN KELUARGA KAPAR INDAH,"2, JALAN HARAPAN 3, SUNGAI KAPAR INDAH",42200,KLANG,SELANGOR,2,,2,,,,,,,,,
120,KLINIK PAKAR WANITA SHEELA SDN. BHD.,"NO 36, 38 & 40, JALAN BATAI LAUT 3, KAWASAN 16, TAMAN INTAN",41300,KLANG,SELANGOR,10,,6,,,,,,,,,
121,KMI KELANA JAYA MEDICAL CENTRE,"NO. 1, FAS BUSINESS AVENUE, JALAN PERBANDARAN SS7, KELANA JAYA",47301,PETALING JAYA,SELANGOR,33,,3,2,,,,,,,,
122,KO SPECIALIST MEDICAL CENTRE,"6 – 12, TINGKAT BAWAH, JALAN TEMOH, OFF JALAN GOH HOCK HUAT",41400,KLANG,SELANGOR,6,,,,,,,,,,,
123,AMPANG PUTERI SPECIALIST HOSPITAL,"NO.1, JALAN MAMANDA 9, TAMAN DATO' AHMAD RAZALI",68000,AMPANG,SELANGOR,297,6,16,8,23,9,28,,2,,,
124,KPJ DAMANSARA SPECIALIST HOSPITAL,"NO. 119, JALAN SS 20/10, DAMANSARA UTAMA",47400,PETALING JAYA,SELANGOR,198,,10,10,,1,20,3,,1,,
125,KPJ KAJANG SPECIALIST HOSPITAL,"BATU 14, JALAN CHERAS",43000,KAJANG,SELANGOR,145,18,10,8,,,,,,,,
126,KPJ KLANG SPECIALIST HOSPITAL,"NO. 102, PERSIARAN RAJAWALI/KU1, BANDAR BARU KLANG",41150,KLANG,SELANGOR,177,19,4,,,,36,,1,,,
127,KPJ RAWANG SPECIALIST HOSPITAL (HOSPITAL PAKAR KPJ RAWANG),"JALAN RAWANG, BANDAR BARU RAWANG",48000,RAWANG,SELANGOR,164,,8,3,,,17,,,,,
128,KPJ SELANGOR SPECIALIST HOSPITAL,"LOT 1, JALAN SINGA 20/1, SEKSYEN 20",40300,SHAH ALAM,SELANGOR,192,,12,6,,,22,2,,,,
129,KPMC PUCHONG SPECIALIST CENTRE,"NO. 1 & 3, JALAN PUTERI 2/1, BANDAR PUTERI PUCHONG",47100,PUCHONG,SELANGOR,23,,5,,,,,,,,,
130,HOSPITAL WANITA METRO,"NO. 33, 35, 37 & 39, JALAN RHU 1, TAMAN RHU, OFF JALAN KELANG",45000,KUALA SELANGOR,SELANGOR,4,,4,,,,,,,,,
131,MSU MEDICAL CENTRE,NO. 4 (PT NO. 1108) PERSIARAN OLAHRAGA,40100,SHAH ALAM,SELANGOR,147,1,6,,,2,14,2,,2,2,
132,PANTAI HOSPITAL KLANG,"LOT 5921, PERSIARAN RAJA MUDA MUSA",41200,KLANG,SELANGOR,107,,4,1,,4,10,,1,,,
133,PUSAT PAKAR ORTOPEDIK OSC ORTHOPAEDIC SPECIALIST CENTRE,"G-1-1 TO G-6-1 DAMEN USJ, PERSIARAN KEWAJIPAN, USJ 1",47600,SUBANG JAYA,SELANGOR,9,,,,,,,,,,,
134,PUSAT PERUBATAN DAMANSARA DAMAI,"TINGKAT BAWAH, BLOK B, 002- 005, JALAN PJU 10/2A, PJU10, DAMANSARA DAMAI",47830,PETALING JAYA,SELANGOR,4,,4,,,,,,,,,
135,PUSAT PERUBATAN JOE (KLINIK WANITA DAN KANAK-KANAK),"3G & 5G, JALAN WAWASAN 4/1, BANDAR BARU AMPANG",68000,AMPANG,SELANGOR,2,,4,,,,,,,,,
136,PUSAT PERUBATAN PAKAR SRI KOTA,JALAN MOHET,41000,KLANG,SELANGOR,122,6,8,2,,,20,,1,,,
137,QHC MEDICAL CENTRE,"NO. 2, JALAN USJ 9/5R",47620,UEP SUBANG JAYA,SELANGOR,10,,4,,,,,,,,,
138,SALAM SHAH ALAM SPECIALIST HOSPITAL,"2-14, JALAN NELAYAN 19/B, SEKSYEN 19",40300,SHAH ALAM,SELANGOR,65,,3,2,,,,,,,,
139,SENTOSA SPECIALIST HOSPITAL,"NO. 25, 27 & 29, LORONG TEMENGGUNG 15A DAN NO. 2, 4, & 6, LORONG TEMENGGUNG 15D, OFF JALAN SUNGAI JATI",41200,KLANG,SELANGOR,49,,3,,,1,,,,,,
140,SUBANG JAYA MEDICAL CENTRE,"NO 1, JALAN SS 12/1A",47500,SUBANG JAYA,SELANGOR,442,19,33,6,,11,36,8,,,,
141,SUNGAI LONG SPECIALIST HOSPITAL,"LOT PT 21147, PERSIARAN SUNGAI LONG 1, BANDAR SUNGAI LONG",43000,KAJANG,SELANGOR,46,,4,,,,,,,,,
142,SUNWAY MEDICAL CENTRE,"5, JALAN LAGOON SELATAN, BANDAR SUNWAY",47500,SUBANG JAYA,SELANGOR,767,47,24,9,,,52,7,1,4,,
143,THOMSON HOSPITAL KOTA DAMANSARA,"NO 11, JALAN TEKNOLOGI, TAMAN SAINS SELANGOR 1, PJU 5 KOTA DAMANSARA",47810,PETALING JAYA,SELANGOR,403,,30,19,,,10,,1,,,
144,UITM PRIVATE SPECIALIST CENTRE,"LEVEL 2, 4 & 5, BANGUNAN PENGAJIAN KLINIKAL, FAKULTI PERUBATAN   UITM, KAMPUS SG. BULOH, JALAN HOSPITAL",47000,SUNGAI BULOH,SELANGOR,30,,4,,,1,,,,,,
145,PUTRA MEDICAL CENTRE,"43, 43A, 45, 45A, 47, 47A, JALAN BRP 1/3, BUKIT RAHMAN PUTRA",47000,SUNGAI BULOH,SELANGOR,13,,6,,,,,,,,,
146,HOSPITAL REGEN REHAB,"NO.  9, JALAN  13/4",46200,PETALING JAYA,SELANGOR,48,,,,,,,,,,,
147,DAEHAN REHABILITATION HOSPITAL PUTRAJAYA,"BLOCK B, TWO IOI SQUARE, IOI RESORT",62502,PUTRAJAYA,SELANGOR,109,,,,,,,,,,,
148,HOSPITAL PICASO,"NO 110, JALAN PROFESSOR KHOO KAY KIM, SEKSYEN 19",46300,PETALING JAYA,SELANGOR,65,13,,,,,,,,,,
149,OHANA SPECIALIST HOSPITAL,"NO. 9, 11, 13-1 & 13-2 JALAN SERI REJANG, RAMPAI BUSINESS PARK SOUTH",53300,KUALA LUMPUR,SELANGOR,18,,16,,,2,,,,,,
150,KMI KUALA TERENGGANU MEDICAL CENTRE,"LOT 3963, KAMPUNG BATU BURUK JALAN SULTAN MAHMUD, MUKIM BATU BURUK",20100,KUALA TERENGGANU,TERENGGANU,82,,4,2,2,,,,,,,
151,"SALAM SPECIALIST HOSPITAL, KUALA TERENGGANU","LOT 4075, JALAN ENGKU SAR",20200,KUALA TERENGGANU,TERENGGANU,65,,4,,,,,,,,,
152,GLENEAGLES HOSPITAL KOTA KINABALU,"RIVERSON @ SEMBULAN, BLOK A-1, LORONG RIVERSON @ SEMBULAN",88100,KOTA KINABALU,SABAH,146,,3,5,,5,4,2,,2,,
153,JESSELTON MEDICAL CENTRE SDN. BHD.,"METRO TOWN, JALAN BUNGA ULAM RAJA, JALAN LINTAS, OFF JALAN TUARAN",88300,KOTA KINABALU,SABAH,50,,10,,,2,,,,,,
154,KMI TAWAU MEDICAL CENTRE (TAWAU SPECIALIST HOSPITAL),"TB 4551, JALAN ABACA",91000,TAWAU,SABAH,7,,3,,,,,,,,,
155,KPJ SABAH SPECIALIST HOSPITAL,"LOT NO. 2, OFF JALAN DAMAI, LUYANG",88300,KOTA KINABALU,SABAH,137,6,9,2,,3,10,,,,,
156,RAFFLESIA MEDICAL CENTRE SDN. BHD.,"LOT 4-8, MILLENIUM COMMERCIAL CENTRE, OFF JALAN LINTAS",88200,KOTA KINABALU,SABAH,8,,4,1,,,,,,,,
157,TAWAU SPECIALIST MEDICAL CENTRE SABAH SDN. BHD.,"NO. 3680 - 3692, TANAH LOT 107525664 - 107525780, TINAGAT PLAZA MILE 2.5, JALAN BUNGA RAYA, OFF JALAN APAS",91000,TAWAU,SABAH,52,,6,,,,6,,,,,
158,UTAMA MEDICAL CENTRE,"LOT 16 – 20, BLOK B1, UTAMA PLACE, PHASE 5, BATU  6, JALAN UTARA",90000,SANDAKAN,SABAH,6,,3,,,,,,,,,
159,BINTULU MEDICAL CENTRE,"LOT 6009, BLOCK 31, KEMENA LAND DISTRICT",97000,BINTULU,SARAWAK,58,,5,,,2,10,,,2,,
160,BORNEO MEDICAL CENTRE,"LOT 10992, SECTION 64, KUCHING TOWN LAND DISTRICT, JALAN TUN JUGAH",93350,KUCHING,SARAWAK,80,,6,2,,,20,,,3,,
161,BORNEO MEDICAL CENTRE (MIRI),"LOT 1959, BLOCK 10, MCLD, JALAN CAHAYA, OFF JALAN MIRI-BINTULU",98000,MIRI,SARAWAK,68,,4,,,,10,,,3,,
162,KEMENA PACIFIC HOSPITAL,"LOT 3582 & 3583, BLOK 26, KEMENA LAND DISTRICT, JALAN TAN SRI IKHWAN, TANJUNG KIDURONG",97000,BINTULU,SARAWAK,21,1,4,,,,,,,1,,
163,COLUMBI ASIA HOSPITAL-MIRI,"LOT 1035-1039, 1ST FLOOR & 2ND FLOOR LOT 1040 DAN LOT 1041-1042, JALAN BULAN SABIT",98000,MIRI,SARAWAK,22,,5,,,,,,,,,
164,HELEN NGU WOMEN HOSPITAL,"TINGKAT 1, NO. 251, LOT 2579, CENTRAL PARK COMMERCIAL CENTRE, 3RD MILE",93200,KUCHING,SARAWAK,3,,,,,,,,,,,
165,KPJ KUCHING SPECIALIST HOSPITAL,"LOT 18807, BLOCK 11, MUARA TEBAS LAND DISTRICT",93350,KUCHING,SARAWAK,75,,5,,,4,20,,,,,
166,KPJ MIRI SPECIALIST HOSPITAL,"LOT 8836 (PART OF LOT 6183 AND 6186), BLOCK 11, KUALA BARAM LAND DISTRICT, OFF TUDAN KUALA BARAM LINK ROAD, BANDAR BARU PERMY JAYA",98107,MIRI,SARAWAK,42,,4,1,,1,,,,,,
167,MIRI CITY MEDICAL CENTRE,"LOT 916-920 & 1202-1203, JALAN HOKKIEN",98000,MIRI,SARAWAK,20,,3,1,,,,,,1,,
168,NORMAH MEDICAL SPECIALIST CENTRE,"LOT 937, SECTION 30, KTLD, JALAN TUN ABDUL RAHMAN YAKUB, PETRA JAYA",93050,KUCHING,SARAWAK,70,,3,3,,,22,,,1,,
169,REJANG MEDICAL CENTRE,"GROUND FLOOR, NO. 27, 29 & 31, 1ST, 2ND & 3RD FLOOR, NO. 21, 23, 25, 27, 29, 31, 33, 35& 37, JALAN DR. WONG SOON KAI (JALAN PEDADA)",96000,SIBU,SARAWAK,49,,9,1,,,15,,,,,
170,SIBU SPECIALIST MEDICAL CENTRE,"NO. 52A-G, BROOKE DRIVE",96000,SIBU,SARAWAK,34,,4,1,,,,,,,,
171,TIMBERLAND MEDICAL CENTRE,"LOT 5160-5169 & 7477-7486, BLOCK 16, KCLD, 2½MILE, JALAN ROCK",93250,KUCHING,SARAWAK,82,,,2,4,6,21,,1,,,
172,AL-ISLAM SPECIALIST HOSPITAL,"NO. 85, JALAN RAJA ABDULLAH, KAMPUNG BARU",50300,KUALA LUMPUR,WP KUALA LUMPUR,26,,4,1,,,5,,,1,,
173,ALTY ORTHOPAEDIC HOSPITAL,"LEVEL GROUND, LEVEL 1 HINGGA 4, 5-1, 6-1, 7-1 & 8-1, MENARA ALTY, NO 187, JALAN AMPANG",50450,KUALA LUMPUR,WP KUALA LUMPUR,31,,,,,,,,,,,
174,BEVERLY WILSHIRE MEDICAL CENTRE,"LEVEL 8 & 9, KENANGA TOWER, NO. 237, JALAN TUN RAZAK",50400,KUALA LUMPUR,WP KUALA LUMPUR,11,,,,,,,,,,,
175,CARDIAC VASCULAR SENTRAL KUALA LUMPUR,"JALAN STESYEN SENTRAL 5, KUALA LUMPUR SENTRAL",50470,KUALA LUMPUR,WP KUALA LUMPUR,65,,,,,,,,1,,,
176,CENGILD G.I MEDICAL CENTRE,"UNIT 2-3 & 2-4, NEXUS @ BANGSAR SOUTH, NO. 7, JALAN KERINCHI",59200,KUALA LUMPUR,WP KUALA LUMPUR,36,4,,,,,,,,,,
177,CHAUDHURY MEDICAL CENTRE,"NO 15, JALAN 5/65C, OFF JALAN PAHANG BARAT, PEKELILING BUSINESS CENTRE",53000,KUALA LUMPUR,WP KUALA LUMPUR,4,,4,,,,,,,,,
178,CHERAS SPECIALIST MATERNITY CENTRE,"55, JALAN 2/90 TAMAN PERTAMA",56100,CHERAS,WP KUALA LUMPUR,4,,4,,,,,,,,,
179,COLUMBIA HOSPITAL,"NO. 1, JALAN DANAU SAUJANA, OFF JALAN GENTING KLANG",53300,KUALA LUMPUR,WP KUALA LUMPUR,85,6,7,,,3,,,,,,
180,DAMAI SERVICE HOSPITAL (HQ) SDN BHD,109-119 (1ST MILE) JALAN SULTAN AZLAN SHAH,51200,KUALA LUMPUR,WP KUALA LUMPUR,54,,4,,2,,,,,,,
181,GLENEAGLES HOSPITAL KUALA LUMPUR,"282, 286 & 288, BLOCK A, B & MEDICAL OFFICE BLOCK (GROUND FLOOR), JALAN AMPANG",50450,KUALA LUMPUR,WP KUALA LUMPUR,406,10,30,8,,,17,,,,,
182,GLOBAL DOCTORS HOSPITAL,"LEVEL 2A, 3A & 4A, KIARA DESIGNER SUITE, NO. 18, JALAN KIARA 3, MONT KIARA",50480,KUALA LUMPUR,WP KUALA LUMPUR,11,,,,,,,,,,,
183,HOSPITAL KIARA MEDICAL CENTRE,"NO. 244, JALAN IPOH",51200,KUALA LUMPUR,WP KUALA LUMPUR,25,,4,,,1,,,,,,
184,HOSPITAL PAKAR DAMANSARA 2,"NO .1 JALAN BUKIT LANJAN 3, BUKIT LANJAN",60000,KUALA LUMPUR,WP KUALA LUMPUR,139,,4,3,10,,,8,2,,,
185,HOSPITAL PAKAR KPJ TAWAKKAL KL (KPJ TAWAKKAL KL SPECIALIST HOSPITAL),NO 1 JALAN PAHANG BARAT ,53000,KUALA LUMPUR,WP KUALA LUMPUR,224,,10,"7
3",,4,,,4,,,
186,HOSPITAL PAKAR WANITA SARMUKH,"167, JALAN GENTING KELANG, SETAPAK",53300,KUALA LUMPUR,WP KUALA LUMPUR,3,,,,,,,,,,,
187,HOSPITAL PAKAR PUSRAWI KUALA LUMPUR,"LOT 149, JALAN TUN RAZAK",50400,KUALA LUMPUR,WP KUALA LUMPUR,169,,20,8,6,,10,,,,,
188,PUSAT PERUBATAN NALURI,"NO. 94,92-2, 90-2, 88-2 & 86-2 JALAN WANGSA DELIMA 6, PUSAT BANDAR WANGSA MAJU

",53300,KUALA LUMPUR,WP KUALA LUMPUR,11,,2,2,,,,,,,,
189,IHEAL MEDICAL CENTRE KUALA LUMPUR,"LEVEL 7 & 8, ANNEXE BLOCK, MENARA IGB, MID VALLEY CITY, LINGKARAN SYED PUTRA",59200,KUALA LUMPUR,WP KUALA LUMPUR,9,,,,,,,,,,,
190,INSTITUT JANTUNG NEGARA,"145, JALAN TUN RAZAK",50400,KUALA LUMPUR,WP KUALA LUMPUR,437,,,,,,6,18,,,,
191,KLINIK PAKAR WANITA KEPONG DAN PUSAT BERSALIN,"17, JALAN METRO PERDANA TIMUR SATU, TAMAN USAHAWAN KEPONG",52100,KUALA LUMPUR,WP KUALA LUMPUR,4,,2,,,,,,,,,
192,KLSMC HOSPITAL,"47, JALAN DUNGUN, DAMANSARA HEIGHTS",50490,KUALA LUMPUR,WP KUALA LUMPUR,23,,,,,,,,,,,
193,KMI TAMAN DESA MEDICAL CENTRE,"45, JALAN DESA, TAMAN DESA, OFF JALAN KLANG LAMA",58100,KUALA LUMPUR,WP KUALA LUMPUR,31,,4,,,,,,,,,
194,KPJ SENTOSA KL SPECIALIST HOSPITAL,"36, JALAN CHEMUR, KOMPLEKS DAMAI",50400,KUALA LUMPUR,WP KUALA LUMPUR,80,,4,,,,11,,,,,
195,PANTAI HOSPITAL AMPANG,"JALAN PERUBATAN 1, PANDAN INDAH",55100,KUALA LUMPUR,WP KUALA LUMPUR,117,,4,,,2,15,,1,,,
196,PANTAI HOSPITAL CHERAS,"LEVEL 33A, MERCU ASPIRE, NO.3 JALAN BANGSAR, KL ECO CITY ",56100,KUALA LUMPUR,WP KUALA LUMPUR,126,,13,4,,,6,,,,,
197,PANTAI HOSPITAL KUALA LUMPUR,"NO. 8, JALAN BUKIT PANTAI",59100,KUALA LUMPUR,WP KUALA LUMPUR,507,20,25,11,,,,,,3,,
198,"PARKCITY MEDICAL CENTRE





","NO. 2, JALAN INTI SARI PERDANA, DESA PARKCITY",52200,KUALA LUMPUR,WP KUALA LUMPUR,186,5,16,4,4,4,11,,,,,
199,PUDU SPECIALISTS' CENTRE SDN BHD,"20-26, JALAN BABA, OFF CHANGKAT THAMBI DOLLAH,PUDU",55100,KUALA LUMPUR,WP KUALA LUMPUR,4,,,,,,,,,,,
200,PUSAT DIAGNOSTIK JANTUNG MAA MEDICARE CARDIAC DIAGNOSTIC CENTRE,"NO. 183, 4TH AND 5TH FLOOR, WISMA MAA-MEDICARE, JALAN IPOH",51200,KUALA LUMPUR,WP KUALA LUMPUR,4,,,,,,,,,,,
201,PUSAT PAKAR ORTOPEDIK QUILL ORTHOPAEDIC SPECIALIST CENTRE,"NO. 95, 97, 99, 95A, 97A, 99A, 101A, 95B, 97B, 99B & 101B, JALAN AMINUDDIN BAKI, TAMAN TUN DR. ISMAIL",60000,KUALA LUMPUR,WP KUALA LUMPUR,17,,,,,,,,,,,
